Game,like,date,comment,good
sunkenland,1,2023-09-11,번역이 뜨는것과 어차피 필수품목은 타게임들과 동일해서 딱히 이게 문제되진 않음 몹들의 에임이 너무 정확하여 은페엄페할수 없다면 최하 난이도로 해도 한방컷이 날 수 있다는 그런 파괴적인 밸런스를 제외 하곤 할만하다 할 수 있습니다 아 요번에 패치를 더 했던데 월 일시점 그전엔 방어력 올리면 피가 덜다는게 느껴졌는데방어구 내구도 패치후론 기존 대미지의 배 이상이 들어온다는 ,0
sunkenland,1,2023-09-10,갓겜,0
sunkenland,1,2023-09-10,친구랑 놀기 좋음,0
sunkenland,1,2023-09-09,Raft 와는 다르게 바다 위에서 집짓고 살아가는 게임한글 패치나 최적화 등 몇 가지 아쉬운 부분이 있지만 현시점에서 잠재적인 재미가 상당히 기대되는 게임,1
sunkenland,1,2023-09-09,good,0
sunkenland,1,2023-09-08,나쁘지 않음 얼리 치고 괜찮은 퀄리티에 향후 업데이트가 매우 기대됨 나름 이 게임에 애정 있게 플레이 할거같음,1
sunkenland,0,2023-09-08,러스트 스트랜디드 딥 ,0
sunkenland,1,2023-09-07,게임성은 좋다고 보나 아직 부족한게 많음 최적화도 최적화지만 오브젝트 판정이 좀 크다 생각함 NPC 들은 엄폐해서 뒤에서 쏘는데 플레이어 기준으로 엄폐해서 쓰면 엄폐물에 총알이 박히는 판정이 좀 많다고 생각함 조금 개선이 필요하다고 생각함,1
sunkenland,1,2023-09-07,아니 그 시민센터 커다란 건물들 왜 안들어 가짐 ,1
sunkenland,1,2023-09-06,재밌어요 러스트 래프트 나이트오브데드 세븐데이즈투다이 a 다 쪼금씩 있는 느낌 ,0
sunkenland,0,2023-09-06,버그 진짜 많다 게임 끄고 다시 접속 하는 순간 내 캐릭터가 입고 있던 옷 다 사라짐 물론 도구들도 통조림 한개랑 콜라뿐 그리고 가끔 파밍 하다보면 분명 뚫려 있는 문이 없는 아치 인데 안에 상자들 있고 한데 보이지 않는 결계가 있어서 진입이 안된다 건물 외벽을 돌며 벽 넘어로 파밍을 해야 한다,0
sunkenland,1,2023-09-06,장점 장르 단점 한글화 패치 개떡같이 해놔서 차 뇌절옴 그래픽 최고 사양인데도 좀 어지럽고 별로임나중에 패치하면 해야지,0
sunkenland,1,2023-09-05,오랜만에 재밌는게임 나왔네여 한국인들만 친추해주시면 저희가 천천히 알려드립니다 디스코드 가능하며 초보자분들도 재밌고 쉽게 플레이 하는것이 저희 목표되겠습니다 나이x성별x 아무조건 없습니다 ,0
sunkenland,1,2023-09-05,아무 기대없이 시작했다 근데 생각보다 노가다 하는 맛 총 쏘는 맛 약탈하는 맛이있다 마치 소말리아 해적 시뮬레이터 인것 같다 아니 근데 최고 티어 배면 상자 한 개는 잇어야 하는거 아님 왜 하나 뿐임,1
sunkenland,1,2023-09-04,게임은 정말 재밌고 가능성이 충분해요 근데 당장 구매해 라고는 말하기힘들어요 묘하게 구린 최적화 발번역 특정템은 번역조차 제공해주지않고 게임 버전이 다르면 세이브파일에 잇는 캐릭터 아이템 날리기등 단점도 많습니다 다른 리뷰들 더 보시고 구매하는게 좋을듯,0
sunkenland,1,2023-09-04,똥꾸린내가 진동을 하는데 몇시간 맡아보니 된장 냄새 같기도 하다,1
sunkenland,1,2023-09-04,스토리가 부족,1
sunkenland,1,2023-09-04,재밌다 혼자 설렁설렁 시간순삭,1
sunkenland,1,2023-09-05,러스트 레프트 더 포레스트 느낌 남물론 위에 말한 게임들보단 저퀄리티인데나름 구색은 갖추고 있어서 재미는 있음 총쏘는 것도 조작감 나쁘지 않고가격도 비싸지 않고 친구들이랑 하기 좋음아직 얼리라서 그런지 컨텐츠가 적고 버그도 상당수 있음근데 개발사가 열심히 버그체크하고 업데이트 하는거 보면 앞으로 괜찮은 B급 생존게임 생길거 같음좀 더 묵혔다가 나중에 다시해야지 ,1
sunkenland,1,2023-09-04,학교 가야하는데 아침수업인데 학교 가야하는데 아침수업인데 학교 가야하는데 아침수업인데 학교 가야하는데 아침수업인데 학교 가야하는데 아침수업인데 학교 가야하는데 아침수업인데 학교 가야하는데 아침수업인데 학교 가야하는데 아침수업인데 학교 가야하는데 아침수업인데 학교 가야하는데 아침수업인데 학교 가야하는데 아침수업인데 학교 가야하는데 아침수업인데 학교 가야하는데 아침수업인데 학교 가야하는데 아침수업인데 학교 가야하는데 아침수업인데 ,0
sunkenland,1,2023-09-04,진짜 얼리억세스 치고 굉장히 잘 즐기고 있는 게임 아는 사람들이랑 하면 개꿀잼임 아 물론 친구 DLC는 판매 안하니 조심하시고요 그냥 좀만 다듬고 월드 확장시키면 진짜 러스트 레프트 성큰랜드 라는 공식 세워질거 같음아 그리고 한글패치 버그좀 유저들이 고치는게 아닌 게임에서 원활하게 돌아갈 수 있도록 해주셨음 합니다 ,1
sunkenland,1,2023-09-04,호스팅 서버 만들때 어지간하면 비밀번호 설정하고 하세요비번 설정 안하면 핵쟁이들 옵니다헬기를 소환하질 않나 플라잉 하면서 총 쏘질 않나 뭐 괴롭힐려고 그냥 깽판 치러 오는 애자식들은 예상은 했는데 진짜 어이가 없네 ,1
sunkenland,1,2023-09-04,이 게임이 칭찬받아 마땅한 것 얼리억세스 이후 정식 출시를 위해 끊임없이 업데이트하는 것 그 로드맵을 말하고 지키려고 노력하는 것 게임이 재밌는 것 ,0
sunkenland,1,2023-09-04,개추,0
sunkenland,1,2023-09-04,해당 게임은 멀티 플레이 위주의 게임 입니다 혼자 플레이 할 시 인벤토리 압박 때문에 제대로 파밍하기가 힘든 경우가 많이 생깁니다 멀티로 배를 여러대 운용하면 다른 섬을 쉽게 약탈 가능하지만혼자 플레이 시 여러번 왔다갔다 해야하는 번거로움 때문에 기지 공격에 취약해집니다 역할 분담이 필요한 발헤임 같은 게임을 생각하시면 편합니다 솔로 플레이 시 약탈자 옵션을 끄면 되긴 하는데 해당 게임 컨텐츠의 대부분이방어와 약탈 이라고 봐도 무방하기 때문에 해당 옵션을 끄면 재미 방어 컨텐츠 삭제 가 반감되어 버립니다 그렇기 때문에 이 게임을 시작하실 경우에는 무조건 멀티플레이를 추천 드리고 솔로 플레이의 경우에는 비추천 입니다 적이 주기적으로 아군 창고 스토리지 를 기준으로 공격을 오기 때문에 방어가 필요 함 아이템 최대 스택 수가 빡빡하고 파밍 해야하는 섬이 멂 원정동안 방어에 취약해짐 혼자일 경우 복귀 하는 동안 기지가 벌집이 되어 있을 확률이 커짐 위의 불편한 문제들은 인원 수로 극복 가능 하므로 멀티 플레이가 필요,0
sunkenland,1,2023-09-03, 마성의 매력이 있음 아직 얼리에 생각보다 조잡한 AI와 조잡한 그래픽이지만 게임성 자체는 좋은 편이라 재미는 있습니다 개씨발 좆같은 해적 새끼들이 일 꼴로 오는데 철 수급은 끔찍하고 종결 보트 종이 철만 개 처먹고 AK M M 세 개 만드는데도 총 개 대가리랑 갑옷 만드는데 개씩 처먹어서 집을 철로 지을 수가 없음 한 일 정도면 벽 정도는 겨우 두를 듯 얼리 특성이라고 해야 하나 일단 컨텐츠 소모 속도도 빠르고 컨텐츠 자체가 별로 없음 심지어 상점 주인 씹련은 파는 건 별로 없고 그것도 대체로 다 초반에 사용하는 것들이라 일 이후로는 가끔 배터리가 사라지는 버그가 있어서 배터리 사거나 총알 수급 때문에 화학물질 사는 정도 말고는 갈 일이 진짜 별로 없음 나름의 종결 보트가 종 있는데 개인적으로는 제트스트림 보우라이더가 취향에 맞음 오른쪽에 운전석이 있어서 좀 뭔가 불편하긴 한데 마린 패스트 보트는 물 위에서 존나 통통거리고 파도에 영향을 더 많이 받는 것 같음 그리고 핸들링이 끔찍함 이 게임은 나무 철 구리 정도는 리젠이 되는 게임이라 갑자기 모자라다 그러면 나무랑 철 정도는 작은 바위 섬에서 조금 캘 수 있음 지형 같은 건 바꿀 수 없음 유린자의 섬에 자리 그냥 잡고 집 다 짓긴 했는데 이 망할 병신 게임 앞에 존나 큰 돌덩이 두 개를 치울 수가 없어서 개좁은 길을 통과하거나 뛰어 넘어야 옆 건물로 넘어갈 수 있게 됐음,1
sunkenland,1,2023-09-03,재미없어서 시간안에집만든다음 끄고 환불해야겠다했는데 집만들고나니까 시간이네 밤까지샘 진짜 재밌음,0
sunkenland,1,2023-09-03,그럭저럭 할만함 친구랑 같이 하길 ,2
sunkenland,1,2023-09-03,아니오고무,0
sunkenland,0,2023-09-03,게임 주 컨텐츠가 단 일만에 끝났다 명이서 플레이해서 그런지 모르겠지만 완성도가 조금 하자가 있는 점을 감안해야된다 ,0
sunkenland,1,2023-09-03,선즈 오브 포레스트보다 재밌음 업뎃 많이하면 생존 갓겜으로 변할 거라 기대됨 지금 단점은 AI가 상당히 멍청해서 전투가 쉽다는 것 엄폐물 돌 위에서 창질하면 인식 못함 그것과 반대로 이새끼들 화살 쏘는 건 존윅급임 벽 뒤에서 쏘는거 기다렸다가 장전할때 존나 뛰어가서 찌르면 됨그래도 추천함,0
sunkenland,1,2023-09-03, 월 일부터 지금까지 플레이함 둘이서 하는데 재밌네요,0
sunkenland,1,2023-09-03,누 눈 눈 눈이 너무 아프다 시발,3
sunkenland,1,2023-09-03,Good,0
sunkenland,1,2023-09-03,개 재밌음,0
sunkenland,1,2023-09-03,사실 엄청 재미있습니다 배터리 버그만 어찌 안되겠니 배터리 충전기 한번이라도 사용좀 해보자너무 재미있네요 세일때 구입해서 인가 구입했는데 정말 재미있게 하고 있습니다 빨리 배터리 버그좀요,0
sunkenland,1,2023-09-03,재미있습니다 래프트 느낌 다만 한글 번역이 뭐 이렇게 깨지는건지 그리고 친구들이랑 같이 하세요 적들 공격오는데 혼자 막기힘듬 ,0
sunkenland,1,2023-09-02,혼자 즐겨도 재밌는 게임 근데 혼자 하면 초반 넘기기가 많이 어려움 그래도 나중에 업데이트 된다면 기대해도 될꺼같음,0
sunkenland,1,2023-09-02,한글 깨져있지만 딱히 못알아먹을정돈 아님 하지만 그래도 한글 고쳐줬으면 좋겠다 ,0
sunkenland,1,2023-09-02,재밌음 근데 한글패치좀 똑바로 부탁,1
sunkenland,1,2023-09-02,나이트오브데드 레프트 느낌이구요 재미있어요 초반은 좀비가 너무쌤꿈잼보장 잡숴봐 츄라이 츄라이,1
sunkenland,1,2023-09-02,zzz,0
sunkenland,1,2023-09-02,혼자 하기 힘들다 멀티 하세여 멀티 근데 저장 안되는거 뭐죠 ,0
sunkenland,0,2023-09-02,멀미나요,0
sunkenland,0,2023-09-02,제품 환불받음 아직은 좀 더 발전이 필요한 겜,0
sunkenland,1,2023-09-01,there is a hacker already and cant kick him out so all my work is gone need help,1
sunkenland,1,2023-09-01,한글 패치가 제대로 이루어지지 않은 점 빼곤 아직 괜찮은 거 같습니다,1
sunkenland,1,2023-09-01,dd,1
sunkenland,1,2023-09-01,올만에 개재밌는 생존겜나왔네여 ,1
sunkenland,1,2023-09-02,섬파밍 다하고 바닷속 파밍 다하고 집 건설하고 나니 할게 없음 다음 업데이트 빨리 해듀세요 적들이 매일 처들어오는게 싫으면 시작전 설정에서 체크를 하세요 존나 귀찮아 집 수리하기 고치면 쳐들어오고 총알 오링나고 게임 재미도있지만 업데이트 내용을 한글로 번역해준게 제일 맘에든다 타게임들 시봉 한글번역해서 올리라고,1
sunkenland,1,2023-09-01,raft버젼의 러스트 느낌 딱 얼리정도의 완성도카메라 고정기능이 있긴한데 고개를 너무 끄덕거려서 멀미남개인적으로 여러 생존게임 요소들을 가져와서 믹스한 느낌 레프트 러스트 셉투다 정도 지금 당장은 조작감도 구리고 여러 불편요소들이 많지만 추후 패치에 따라 제 의 러스트가 되지않을까 싶음떡상 기다리며 미리 구매하는것도 괜찮다고 생각함,0
sunkenland,1,2023-09-01,뭘 패치를 이렇게 많이 하냐 너무 마음에 드네 ,1
sunkenland,1,2023-09-01,운전석에 타서 아래보고 P 버튼 연타해봐라음속의 배로 항해 가능하다 그리고 이거 상상이상으로 병 신 게임이니까 사지말고 퍼세일 존버해라,1
sunkenland,1,2023-09-01,엄,1
sunkenland,1,2023-09-01,이게 게임이냐 시간잡아먹는 도둑이지 다른사람들 한테 꼭 도둑 잡아달라고 신고한다,2
sunkenland,1,2023-09-01,추천합니다 튜토리얼이 없는게 아쉽지만 한글이 조금깨지고 근데 음 재밌음 레프트느낌,0
sunkenland,1,2023-09-01,세이브 파일 옮기는 법 APPDATA 진입 LocalLow Vector studio 폴더 안 파일 복사 접속한 새로운곳 동일 폴더에 붙여넣기,1
sunkenland,1,2023-09-01,아직 얼리버전이라서 부족한게 많지만 추후 계속 업데이트하고 창작마당 나오면 갓겜아 그리고 스토리 미션 있으면 더 꿀잼 일듯 꼭 추가 해주면 좋겠음 ,0
sunkenland,0,2023-08-31,왜 초기화 시키세요 제가 이게임에 소요된 시간을 보상하시죠,0
sunkenland,0,2023-08-31,멀티 하시려는 분들은 절대 사지 마셈 지금 버그 많음,0
sunkenland,1,2023-08-31,확실히 재미는 있음 하지만 내가 열심히 해저파밍이랑 각종 템들 파밍해서 짜릿할때서버가 팅기거나 멈추고 난뒤 들어오면 업글을 하거나 상자같은거 템들이 아예 사라지고 탐색은 그대로 되있어서 재파밍 불가 진짜 화나긴한데 재밌음 그래서 팅기는거나 각종 버그좀 잡으면 다시 올 예정 혹시 도르마무 거래 좋아하면 추천함 로그라이크 느낌임 하 ,0
sunkenland,1,2023-08-31,재밌음 ,0
sunkenland,0,2023-08-31,친구들이랑 너무 재미있게 게임 했어요 그런데 튕기면 들어가지지 않고 어떻게든 다시 들어가면 상자나 가구들이 사라져있거나 아니면 만들었던 기지 자체가 사라져있습니다 빠른 해결 원합니다 너무 재밌어서 빨리 다시 하고 싶어요 찡긋찡긋,0
sunkenland,1,2023-08-31,무료로 받은 제품 게임은 너무 재밌는데 버그가 조금씩 있었는데 빠른 업데이트를 버그를 잡아줬고지금 정말 재미있게 하고 있어요 갓 게임이에요 ,0
sunkenland,0,2023-08-31,아직 정가 주고 사기엔 버그가 만연하고 오류로 팅기고 나서부터 저장 후 접속 했을 때 백섭이 조금씩 되는 버그가 존재한다 재미는 있지만 많은 개선이 필요해 보임 멀티는 상당히 재밌다 ,0
sunkenland,0,2023-08-30, 같습니다 하지마세요 게임이 서버들어가기부터 힘듬,0
sunkenland,1,2023-08-30,멀티하실때 스팀초대로 하면 버그때문에 초대가 안되니까세계검색하셔서 들어가시면 됩니당,0
sunkenland,1,2023-08-30,넓게 세상을 보고자 새로운 섬에 상륙했더니신이 난 원주민들의 무수한 총알 세례와 몽둥이질 요청이,1
sunkenland,1,2023-08-31,아직은 앞서해보기 라서 한글패치 문제도 있긴한데 그건 감안하고 게임할수있는 수준임 게임 진행할때 가끔 내가 집지은 섬에 공격이 들어오는데 언제 들어오는지 잘모르겠음 파밍 멀리 나가있는데 집공격당하면 초반에 반파됨 멀리 갈일은 없지만 그리고 아직 섬 이 여러게 있는데 대부분 인지 전부 다 인지는 아직 잘모르겠는데 집 지을수있는 섬이 한정되있음 그리거 오늘 겪은 버그인데 저장하고 다음날 접하니까 캐릭터에 있는 아이템 다사라져있음 개빡치네 이런 버그 같은거 감당하고 하실거면 한데버그 때문에 멘탈 깨지기 싫은분은 비추 ,0
sunkenland,1,2023-08-31,드물게 적이 땅에 박혀서 반만 보이는 경우가 있어서 방심했다간 쉽게 죽을 수 있음 AI는 멍청한 면이 있어도 심심하지 않음 점점 더 강해지는 공격 웨이브 시선 유도 후 뒤에서 급습 등섬이나 구역을 파밍하다 보면 에서 멈추는 경우가 있음 버그가 아니라면 찾지 못한 것이겠으나 광물 탐지기 처럼 파밍요소에도 보조 아이템이 있으면 좋을 것 같음 치명적 오류였던 저장 내용의 손실이 현저히 낮아졌으며 다른 여러 버그픽스를 거치며 꽤나 안정적인 모습을 보이고 있음 하지만 여전히 버그들이 존재함 예 익사 후 잔여 아이템 매장됨 그러나 바닥을 뚫고 들어가서 파밍이 가능 배가 하늘로 뜨는 물리엔진 오류 스폰 시 특정 상황에 끼이는 현상 등플레이하는 데에는 지장이 없음 한번씩 이런 현상이 신기하고 거슬리는 정도 멀티의 경우 암호를 필히 설정할 수 있도록 하고 되도록이면 친구를 찾아 플레이하는 것을 추천함 트레이너 또는 핵을 사용해서 게임 진행을 방해하는 사람들이 다수 있음 ,0
sunkenland,0,2023-08-31,그래 헬기 열심히 주차 했는데 물리엔진때문에 즉사하는건 그래 내가 잘못했어 우리집 습격하는 습격자가 무장만 좋아졌지 우리집 뾰족뾰족 울타리만 열심히 치는 어지러운 지능을 가진건 그래 그렇다고 치자 전선이 마구잡이로 정리 안되는거 딴겜도 그런겜 많지 그런데 씨 팔 우리집 화염병이 바닷속에서도 불타오르는 지옥의 화염인건 좀 아니지 시발 ,0
sunkenland,1,2023-08-30,열심히 개발 하라는 뜻으로 구매를 하긴 했는데 아직은 어디에서 재미 포인트를 찾아야 할지 모르겠네요 일단 봉인 ,1
sunkenland,1,2023-08-30,정출존버,1
sunkenland,1,2023-08-30,선최종평가 가격주고 살만한데 할인하면 더 땡큐 킬링타임에 아주 좋다 하다보면 시간이 가있다 DIgX의 The Infected와 비슷한 느낌바다를 이용해 수중도시를 탐험한다는 것이 다른 생존게임과 차별화된 재미 요소이고 향후 개발 방향에 따라 재미가 제곱이 될 전망으로 보인다 서브노티카는 그야말로 바다에서만 생활해야 해서 공포심이 극대화되는 반면 이 게임은 그래도 육지에서 먹고 자고 바다로 파밍나가기 때문에 좀 더 바다가 아름답게 다가와진다 나무를 베는 모션이 조금 어설프고 고철채굴의 귀찮음은 키꾹으로 최대한 줄였다나무 바닷속 고철 광물을 이용할 수 있고 조금 더 멀리 나가면 화학약품이나 고무 등을 얻을 수 있다 패들보트를 만들고나서부터가 굉장한데 패들보트가 섬에서 끼는 것을 방지하기위해 패들보트 운전석에서 아래를 보도록 화면을 밑으로 끌면 P 키로 보트를 밀 수 있게 만들어 놨다 방향은 배의 정면 방향 이 P키를 연타하면 톤 레그프레스의 로니 콜먼에 빙의해 정면으로 시속 Km h 까지 속력을 낼 수 있어서 멀리까지 여행 가능해진다 Km h를 넘기면 상당히 불안정해진다 The Forest와 다르게 Foundation 집을 짓기 위한 기초기반 을 만들 때 높이를 설정하지 못하거나 하나를 만들면 연속해서 처음 것의 높이에 고정되어 만들어야 한다는 점이나 계단이 없는 점 사다리 밖에 없음 요리 재료를 불판 위에 여러 개 놓지 못하거나 싸울 때 수영 할 때 스테미나가 좀 많이 딸리는 게 불편하다면 불편한 점이다 하지만 불 관련 제작에서 금속을 약간 쓰는 화로를 만들어두면 연료가 필요없는 영원히 꺼지지 않는 불을 만들 수 있어 편리한 점도 있다 참고로 고철 저장창고나 통나무 저장창고를 만들바에 나무 보관상자를 만들어서 고철과 나무를 저장하는 것이 훨씬 많이 저장가능하다 ,0
sunkenland,0,2023-08-30, 시바 버그 개많아 저장 무한로딩에 집 만든거 바닥밑에 껴서 나오지도 못하고있음 안해 시바 아이템도 전부 다사라져있네 내 개고생한거 돌려놔,0
sunkenland,1,2023-08-30, 신경쓰이면 한글화 끝나고 하길 권장함,1
sunkenland,1,2023-08-30,생존게임 가뭄인데 이정도의 가격이면 좋다고 생각합니다건축 농사 디펜스요소할만한게임임 ,1
sunkenland,1,2023-08-30,처음 분 시간하고 안맞으면 환불하면 되니까 뭐 컨텐츠 아직 별로 없네이후 지도 넓혀가면서 바쁘다바빠 선큰랜드,1
sunkenland,1,2023-08-30,생각보다 개재밌음,1
sunkenland,1,2023-08-29,유통기한이 지난 음식이지만 맛이 좋은,3
sunkenland,1,2023-08-30,러스트 래프트 더 포레스트를 합친 게임기본적인 컨셉이나 게임 플레이 요소들이 괜찮고 앞으로 발전할 가능성이 보임한글이 으로 나오는 문제는 리뷰에 해결법 적어두신 분꺼 따라하거나 공식 패치를 기다리십쇼 그리고 게임 자체가 모션인지 카메라인지 살짝 끊기는 느낌을 주는데 이게 멀미 유발이 상당합니다 적응을 하면 쫌 괜찮지만 그때까진 쫌 힘듭니다 게다가 시야각 옵션이 아직 없어서 멀미 체감이 더 심합니다 ,1
sunkenland,1,2023-08-29,마치 여름 휴양지를 온 기분이 드는 게임이네요 미지의 세계에 대한 탐험 욕망이 생겨요 ,1
sunkenland,1,2023-08-29,pc방에서 게임하고 집에와서 이어서 하려는데 저장이 안되어있고 그냥 모든게 초기화네 저장방법 급구한다 게임자체는 재미있다,0
sunkenland,0,2023-08-29, 시간 해봤는데 재미없어서 환불합니다 한글 번역 엄청 깨져있습니다 ,0
sunkenland,1,2023-08-28,배터리나 산소통을 호스트가 놓고 참여인원이 먹은 후에 다시 호스트가 탬을 빼면 아이템이 복사가 됩니다 덕분에 상점에서 아이템 마구마구 사버림,0
sunkenland,1,2023-08-28,진심 개 핵 어 엄청 재밌다 레알루다가 완전 추천함,0
sunkenland,1,2023-08-28,왜 저장이 안되지,0
sunkenland,1,2023-08-28,이거 뭔데 이렇게 잼있냐 도랐네 속는셈 쳤다해도 너무 꿀잼인데 갓겜이다 이거,0
sunkenland,1,2023-08-27, ,1
sunkenland,1,2023-08-28,한글패치에서 버 벅했으나 잘해결하고 재밌게 진행중입니다 베댓 한글패치 및 https seogilang tistory com 참고해서 패치하세요,1
sunkenland,1,2023-08-28,우리나라 복합적은 다 한글때문인것 같고 겜은 재미없진 않음다아만 멀티시 아이템박스가 안열리는 버그 나갔다가 들어오면 템이 사라지는 버그 배가 맵에 낑기는 버그 광석이 한자리에 여러개 겹쳐있는 버그 자잘한것부터 심각한 버그까지 초반인데도 불구하고 여러 버그들이 난무하는걸 목격할 수 있음 난 혼자했으면 벌써 접었을거임 ,0
sunkenland,1,2023-08-27,한글패치가 아쉽긴한데 그래도 즐겜으로 하고있음 어렵지않고 캐주얼하기도하고 꿀잼임,1
sunkenland,1,2023-08-27, 분 소감 묵혀놨다가 년뒤에 보자 ,0
sunkenland,1,2023-08-27,한글은 으로 나오고 번역도 개판이지만게임 자체는 재밌음,0
sunkenland,1,2023-08-27,이거 조금만 손보면 좋은 겜이 될듯,0
sunkenland,1,2023-08-26,래프트랑 러스트를 적당히 잘 버무려놓은 갓겜,0
sunkenland,1,2023-08-26,러스트 래프트 성큰랜드싱글과 멀티 가능 한글지원하는데 스토리나 일부 옵션 네모로 나옴제작이나 재료는 꺠지는 부분 없음유니티엔진으로 만들어서 저사양 컴에서도 돌아갈듯래프트 이후로 물에서 집짓고 사는 겜이 없어서 기다렸는데 이건뭐 완전 영화 워터월드네,0
sunkenland,1,2023-08-26,모션도 어설프고 오브젝트도 구린내가 나긴 하는데 가격대비 그럭저럭 할만함심해 공포증 환자를 배려해서 그런지 물속도 딱히 어둡진 않고 밤에는 들어가지 말라고 추위에 걸림뭔가 raft 실사판 같았는데 겜 해보니 섬과 바다를 싸돌아 다니는 포레스트였음뮤턴트 쳐들어 오다 나중엔 사람까지 무리지어 쳐들어옴 근데 단순 빡대가리 들이라 원거리 무기들고 농성하면 상대하기 쉬움,0
